<?xml version="1.0" encoding="UTF-8"?>
<!ELEMENT hr (employee+)>
<!ELEMENT employee (name,age,salary,department)>
<!ATTLIST employee no CDATA "">
<!ELEMENT name (#PCDATA)>
<!ELEMENT age (#PCDATA)>
<!ELEMENT department (dname,address)>
<!ELEMENT dname (#PCDATA)>
<!ELEMENT address (#PCDATA)>